number,value,datetime_start,datetime_complete,duration,params_learning_rate,params_n_batch,params_n_epochs,params_n_layers,params_n_units_l0,params_n_units_l1,params_n_units_l2,params_optimizer,state
0,0.5998831017015197,2022-11-24 18:08:35.156232,2022-11-24 18:09:13.089061,0 days 00:00:37.932829,0.09426971316116345,19,4,1,6,,,RMSprop,COMPLETE
1,0.6621639173918691,2022-11-24 18:09:13.096150,2022-11-24 18:09:51.097138,0 days 00:00:38.000988,0.03019529647277058,25,6,2,13,4.0,,RMSprop,COMPLETE
2,0.6489154435640992,2022-11-24 18:09:51.098370,2022-11-24 18:10:34.155005,0 days 00:00:43.056635,0.06980253360280787,13,5,1,10,,,RMSprop,COMPLETE
3,0.5925444862969217,2022-11-24 18:10:34.156222,2022-11-24 18:10:57.579975,0 days 00:00:23.423753,0.020286993337450668,24,4,1,4,,,RMSprop,COMPLETE
4,0.5998831017015197,2022-11-24 18:10:57.581620,2022-11-24 18:11:34.480024,0 days 00:00:36.898404,0.026087080647548784,15,4,1,11,,,AdamW,COMPLETE
5,0.5884530458501104,2022-11-24 18:11:34.481127,2022-11-24 18:11:45.986772,0 days 00:00:11.505645,0.022397072553151216,21,5,3,14,15.0,8.0,RMSprop,PRUNED
6,0.6274840888427069,2022-11-24 18:11:45.987722,2022-11-24 18:12:05.662635,0 days 00:00:19.674913,0.08369257653715319,30,3,1,9,,,Adam,COMPLETE
7,0.613521236524224,2022-11-24 18:12:05.663672,2022-11-24 18:12:27.221538,0 days 00:00:21.557866,0.07764459453952348,15,4,1,10,,,Adam,PRUNED
8,0.6137810105208469,2022-11-24 18:12:27.222461,2022-11-24 18:12:50.134082,0 days 00:00:22.911621,0.006467437293981827,15,3,3,4,17.0,11.0,RMSprop,PRUNED
9,0.5434472009351864,2022-11-24 18:12:50.134937,2022-11-24 18:13:02.174615,0 days 00:00:12.039678,0.08648221055334193,17,6,3,9,14.0,11.0,RMSprop,PRUNED
10,0.6140407845174698,2022-11-24 18:13:02.175714,2022-11-24 18:13:17.568413,0 days 00:00:15.392699,0.016358078048376648,22,7,2,12,10.0,,RMSprop,PRUNED
11,0.6038446551500195,2022-11-24 18:13:17.569433,2022-11-24 18:13:31.119491,0 days 00:00:13.550058,0.024930450540728497,26,3,1,10,,,RMSprop,PRUNED
12,0.6132614625276009,2022-11-24 18:13:31.130910,2022-11-24 18:13:44.685994,0 days 00:00:13.555084,0.032525902127835224,28,4,1,13,,,Adam,PRUNED
13,0.5970255877386673,2022-11-24 18:13:44.686811,2022-11-24 18:13:56.473885,0 days 00:00:11.787074,0.015798913008943104,12,5,1,13,,,RMSprop,PRUNED
14,0.6415118846603455,2022-11-24 18:13:56.474930,2022-11-24 18:14:27.348878,0 days 00:00:30.873948,0.010127232164613876,30,7,2,10,14.0,,AdamW,PRUNED
15,0.5865047408754384,2022-11-24 18:14:27.349807,2022-11-24 18:14:45.432092,0 days 00:00:18.082285,0.07491053252790075,9,8,3,11,18.0,5.0,RMSprop,PRUNED
16,0.603714768151708,2022-11-24 18:14:45.432979,2022-11-24 18:15:00.503207,0 days 00:00:15.070228,0.024105227258910445,28,8,2,9,14.0,,AdamW,PRUNED
17,0.5942330172749708,2022-11-24 18:15:00.504330,2022-11-24 18:15:11.741817,0 days 00:00:11.237487,0.0114545185011758,19,3,3,8,6.0,12.0,RMSprop,PRUNED
18,0.6115079880503962,2022-11-24 18:15:11.742663,2022-11-24 18:15:41.697595,0 days 00:00:29.954932,0.08386155447921248,8,8,1,5,,,Adam,PRUNED
19,0.5661774256396934,2022-11-24 18:15:41.698482,2022-11-24 18:15:50.713608,0 days 00:00:09.015126,0.0765619603212098,25,3,2,7,4.0,,RMSprop,PRUNED
20,0.5924795427977659,2022-11-24 18:15:50.714562,2022-11-24 18:16:03.626839,0 days 00:00:12.912277,0.04451710454981237,18,6,3,12,13.0,7.0,Adam,PRUNED
21,0.6052084686322899,2022-11-24 18:16:03.627939,2022-11-24 18:16:20.959790,0 days 00:00:17.331851,0.06480915874008607,18,8,2,9,18.0,,RMSprop,PRUNED
22,0.6663852448369918,2022-11-24 18:16:20.960653,2022-11-24 18:17:23.075198,0 days 00:01:02.114545,0.04541747213094801,14,8,1,14,,,RMSprop,COMPLETE
23,0.5917002208078971,2022-11-24 18:17:23.076338,2022-11-24 18:17:31.531894,0 days 00:00:08.455556,0.037731666350438085,32,3,2,4,11.0,,AdamW,PRUNED
24,0.6574879854526562,2022-11-24 18:17:31.532735,2022-11-24 18:17:54.040328,0 days 00:00:22.507593,0.04095919485636663,30,4,1,15,,,RMSprop,COMPLETE
25,0.6099493440706585,2022-11-24 18:17:54.041428,2022-11-24 18:18:07.679690,0 days 00:00:13.638262,0.017127562470822106,27,7,2,6,9.0,,RMSprop,PRUNED
26,0.5902065203273152,2022-11-24 18:18:07.680701,2022-11-24 18:18:16.744158,0 days 00:00:09.063457,0.01538905029215056,24,4,1,17,,,AdamW,PRUNED
27,0.6517729575269515,2022-11-24 18:18:16.745057,2022-11-24 18:18:53.429167,0 days 00:00:36.684110,0.032266545398608217,25,8,2,13,17.0,,RMSprop,PRUNED
28,0.5913755033121184,2022-11-24 18:18:53.430036,2022-11-24 18:19:09.120355,0 days 00:00:15.690319,0.05984031074190258,13,5,3,15,4.0,9.0,AdamW,PRUNED
29,0.6040394856474867,2022-11-24 18:19:09.121232,2022-11-24 18:19:20.659255,0 days 00:00:11.538023,0.06604433252665329,18,8,2,18,18.0,,Adam,PRUNED
30,0.5808546564488895,2022-11-24 18:19:20.660203,2022-11-24 18:19:32.191455,0 days 00:00:11.531252,0.0787003159862995,15,6,1,8,,,AdamW,PRUNED
31,0.6033251071567736,2022-11-24 18:19:32.192323,2022-11-24 18:19:42.294158,0 days 00:00:10.101835,0.05124428547851513,19,6,1,6,,,AdamW,PRUNED
32,0.5978698532276919,2022-11-24 18:19:42.294986,2022-11-24 18:19:54.372588,0 days 00:00:12.077602,0.021608618867915416,20,7,3,10,5.0,7.0,Adam,PRUNED
33,0.536952851019613,2022-11-24 18:19:54.373484,2022-11-24 18:20:06.158133,0 days 00:00:11.784649,0.07548250004765829,21,5,3,13,4.0,18.0,Adam,PRUNED
34,0.6020911806728146,2022-11-24 18:20:06.159206,2022-11-24 18:20:14.742370,0 days 00:00:08.583164,0.043994621054510026,32,6,2,10,15.0,,Adam,PRUNED
35,0.5454604494090142,2022-11-24 18:20:14.743459,2022-11-24 18:20:29.428098,0 days 00:00:14.684639,0.04059622746353383,15,5,3,5,5.0,12.0,AdamW,PRUNED
36,0.5952721132614626,2022-11-24 18:20:29.429005,2022-11-24 18:20:42.639989,0 days 00:00:13.210984,0.08257221658120265,12,8,2,14,14.0,,RMSprop,PRUNED
37,0.4941550850759839,2022-11-24 18:20:42.640861,2022-11-24 18:20:56.687218,0 days 00:00:14.046357,0.08633416161482711,13,3,3,12,15.0,12.0,RMSprop,PRUNED
38,0.6153396545005845,2022-11-24 18:20:56.688061,2022-11-24 18:21:34.300070,0 days 00:00:37.612009,0.0025556073185762232,9,5,3,4,8.0,10.0,Adam,PRUNED
39,0.5694895440966359,2022-11-24 18:21:34.300981,2022-11-24 18:21:45.320590,0 days 00:00:11.019609,0.049301739485312676,24,6,3,5,16.0,9.0,Adam,PRUNED
40,0.5914404468112742,2022-11-24 18:21:45.321527,2022-11-24 18:21:56.291106,0 days 00:00:10.969579,0.09707401237540463,16,8,1,5,,,Adam,PRUNED
41,0.5487076243668009,2022-11-24 18:21:56.292136,2022-11-24 18:22:04.568792,0 days 00:00:08.276656,0.09989510147484092,27,8,1,9,,,RMSprop,PRUNED
42,0.6081958695934537,2022-11-24 18:22:04.569636,2022-11-24 18:22:14.062646,0 days 00:00:09.493010,0.055698996341901647,27,8,2,12,12.0,,Adam,PRUNED
43,0.6074814911027406,2022-11-24 18:22:14.063681,2022-11-24 18:22:24.853637,0 days 00:00:10.789956,0.08722004888443079,14,7,1,9,,,RMSprop,PRUNED
44,0.6075464346018964,2022-11-24 18:22:24.854499,2022-11-24 18:22:39.304203,0 days 00:00:14.449704,0.03367044786027592,14,8,2,13,11.0,,AdamW,PRUNED
45,0.5620859851928822,2022-11-24 18:22:39.305412,2022-11-24 18:22:48.630233,0 days 00:00:09.324821,0.042571879456490644,25,4,1,15,,,AdamW,PRUNED
46,0.5975451357319133,2022-11-24 18:22:48.631184,2022-11-24 18:22:58.417180,0 days 00:00:09.785996,0.09053564610905368,26,4,2,13,14.0,,Adam,PRUNED
47,0.5860501363813482,2022-11-24 18:22:58.418096,2022-11-24 18:23:06.408217,0 days 00:00:07.990121,0.05093372234923803,28,5,1,12,,,RMSprop,PRUNED
48,0.5425379919470061,2022-11-24 18:23:06.409190,2022-11-24 18:23:15.349411,0 days 00:00:08.940221,0.06411277106002337,32,3,2,12,10.0,,Adam,PRUNED
49,0.5881283283543317,2022-11-24 18:23:15.350241,2022-11-24 18:23:33.545086,0 days 00:00:18.194845,0.014124582582166222,9,3,2,4,18.0,,AdamW,PRUNED
