number,value,datetime_start,datetime_complete,duration,params_learning_rate,params_n_batch,params_n_epochs,params_n_layers,params_n_units_l0,params_n_units_l1,params_n_units_l2,params_optimizer,state
0,0.5837121704117418,2022-11-21 23:22:45.498392,2022-11-21 23:23:28.495477,0 days 00:00:42.997085,0.08499675061322327,16,4,2,18,9.0,,Adam,COMPLETE
1,0.645798155604624,2022-11-21 23:23:28.496913,2022-11-21 23:24:14.005689,0 days 00:00:45.508776,0.08267169677671142,15,6,1,12,,,RMSprop,COMPLETE
2,0.6484608390700091,2022-11-21 23:24:14.006803,2022-11-21 23:24:56.894404,0 days 00:00:42.887601,0.09015610932715375,23,7,1,12,,,Adam,COMPLETE
3,0.5425379919470061,2022-11-21 23:24:56.895812,2022-11-21 23:25:39.121462,0 days 00:00:42.225650,0.08921744821153894,10,3,2,9,8.0,,AdamW,COMPLETE
4,0.6385244836991817,2022-11-21 23:25:39.122608,2022-11-21 23:26:14.289689,0 days 00:00:35.167081,0.08648626137817583,27,7,1,11,,,RMSprop,COMPLETE
5,0.5901415768281595,2022-11-21 23:26:14.290876,2022-11-21 23:26:29.006089,0 days 00:00:14.715213,0.084146931878696,8,3,1,5,,,RMSprop,PRUNED
6,0.6015716326795688,2022-11-21 23:26:29.007143,2022-11-21 23:26:43.117799,0 days 00:00:14.110656,0.09176901373372032,28,3,2,17,10.0,,Adam,PRUNED
7,0.4210287050266268,2022-11-21 23:26:43.118658,2022-11-21 23:26:57.361615,0 days 00:00:14.242957,0.0954196021499476,15,5,3,10,15.0,7.0,AdamW,PRUNED
8,0.42661384595402,2022-11-21 23:26:57.362455,2022-11-21 23:27:17.129528,0 days 00:00:19.767073,0.08406438577891845,9,3,3,8,10.0,6.0,Adam,PRUNED
9,0.5900766333290037,2022-11-21 23:27:17.130345,2022-11-21 23:27:32.675008,0 days 00:00:15.544663,0.08581802172264323,9,6,2,16,11.0,,RMSprop,PRUNED
10,0.5750746850240291,2022-11-21 23:27:32.675854,2022-11-21 23:27:40.350403,0 days 00:00:07.674549,0.09119977345038896,31,5,1,6,,,Adam,PRUNED
11,0.4547993245876088,2022-11-21 23:27:40.351266,2022-11-21 23:27:51.976538,0 days 00:00:11.625272,0.0905291698246551,17,3,2,17,11.0,,Adam,PRUNED
12,0.3556306013768022,2022-11-21 23:27:51.977392,2022-11-21 23:28:01.743658,0 days 00:00:09.766266,0.09047668820104117,23,4,2,10,9.0,,AdamW,PRUNED
13,0.5549422002857514,2022-11-21 23:28:01.744564,2022-11-21 23:28:12.795437,0 days 00:00:11.050873,0.08094669948716392,22,5,3,12,7.0,5.0,Adam,PRUNED
14,0.5792310689699961,2022-11-21 23:28:12.796253,2022-11-21 23:28:23.242250,0 days 00:00:10.445997,0.08969654382730982,20,8,3,15,16.0,7.0,RMSprop,PRUNED
15,0.5868944018703728,2022-11-21 23:28:23.243095,2022-11-21 23:28:34.831045,0 days 00:00:11.587950,0.07861785762447894,17,6,2,7,7.0,,AdamW,PRUNED
16,0.6084556435900766,2022-11-21 23:28:34.831956,2022-11-21 23:28:51.293283,0 days 00:00:16.461327,0.08033080330571325,19,8,2,16,15.0,,RMSprop,PRUNED
17,0.588777763345889,2022-11-21 23:28:51.294188,2022-11-21 23:29:02.868173,0 days 00:00:11.573985,0.09642424174184965,17,3,3,17,4.0,15.0,RMSprop,PRUNED
18,0.5810494869463567,2022-11-21 23:29:02.868981,2022-11-21 23:29:10.821250,0 days 00:00:07.952269,0.0842388057281232,27,7,1,13,,,RMSprop,PRUNED
19,0.5816989219379141,2022-11-21 23:29:10.822145,2022-11-21 23:29:20.791251,0 days 00:00:09.969106,0.09473708750991071,18,5,2,4,16.0,,RMSprop,PRUNED
20,0.5741654760358488,2022-11-21 23:29:20.792053,2022-11-21 23:29:35.927796,0 days 00:00:15.135743,0.09115381314207247,11,5,3,8,16.0,9.0,RMSprop,PRUNED
21,0.562865307182751,2022-11-21 23:29:35.928745,2022-11-21 23:29:46.637222,0 days 00:00:10.708477,0.07718837851440492,19,3,2,9,15.0,,Adam,PRUNED
22,0.5770229899987012,2022-11-21 23:29:46.638096,2022-11-21 23:29:57.334673,0 days 00:00:10.696577,0.08730871317194654,20,3,2,10,16.0,,AdamW,PRUNED
23,0.5385114949993506,2022-11-21 23:29:57.335484,2022-11-21 23:30:14.622831,0 days 00:00:17.287347,0.09218997127099712,9,4,2,16,4.0,,Adam,PRUNED
24,0.5796856734640863,2022-11-21 23:30:14.623804,2022-11-21 23:30:24.344036,0 days 00:00:09.720232,0.08412812507660071,29,8,3,8,13.0,16.0,AdamW,PRUNED
25,0.5827380179244057,2022-11-21 23:30:24.344869,2022-11-21 23:30:34.138949,0 days 00:00:09.794080,0.09094065988385663,23,4,3,15,13.0,12.0,RMSprop,PRUNED
26,0.580464995453955,2022-11-21 23:30:34.139806,2022-11-21 23:30:51.386385,0 days 00:00:17.246579,0.08406133902052239,9,4,3,16,8.0,11.0,RMSprop,PRUNED
27,0.5846863228990778,2022-11-21 23:30:51.387215,2022-11-21 23:31:02.142804,0 days 00:00:10.755589,0.0877069690271991,20,7,2,7,9.0,,Adam,PRUNED
28,0.5900116898298481,2022-11-21 23:31:02.143597,2022-11-21 23:31:10.445975,0 days 00:00:08.302378,0.08996390239354533,32,3,2,10,7.0,,AdamW,PRUNED
29,0.5759189505130536,2022-11-21 23:31:10.446839,2022-11-21 23:31:25.018010,0 days 00:00:14.571171,0.09240627732178659,12,3,2,7,11.0,,AdamW,PRUNED
30,0.33673204312248345,2022-11-21 23:31:25.018836,2022-11-21 23:31:34.433372,0 days 00:00:09.414536,0.08874044286035705,31,7,3,14,8.0,5.0,Adam,PRUNED
31,0.5881932718534875,2022-11-21 23:31:34.434287,2022-11-21 23:31:44.547119,0 days 00:00:10.112832,0.08782648156737767,27,4,3,8,12.0,13.0,AdamW,PRUNED
32,0.45668268606312507,2022-11-21 23:31:44.547923,2022-11-21 23:31:53.366285,0 days 00:00:08.818362,0.08472963755671695,28,7,2,11,4.0,,AdamW,PRUNED
33,0.5288998571243019,2022-11-21 23:31:53.367208,2022-11-21 23:32:07.743002,0 days 00:00:14.375794,0.09122860833075756,12,8,3,5,15.0,14.0,RMSprop,PRUNED
34,0.5936485257825692,2022-11-21 23:32:07.744321,2022-11-21 23:32:16.997543,0 days 00:00:09.253222,0.09633217830312804,22,6,1,9,,,AdamW,PRUNED
35,0.5939082997791921,2022-11-21 23:32:16.998386,2022-11-21 23:32:26.177781,0 days 00:00:09.179395,0.0769147331906734,22,7,1,5,,,AdamW,PRUNED
36,0.6502143135472139,2022-11-21 23:32:26.178579,2022-11-21 23:33:01.488799,0 days 00:00:35.310220,0.08639996084439124,12,4,1,14,,,RMSprop,COMPLETE
37,0.5752695155214963,2022-11-21 23:33:01.489873,2022-11-21 23:33:12.585613,0 days 00:00:11.095740,0.08377787118326495,21,8,3,8,7.0,17.0,Adam,PRUNED
38,0.5433822574360306,2022-11-21 23:33:12.586540,2022-11-21 23:33:22.805772,0 days 00:00:10.219232,0.09074675014883112,21,4,3,15,16.0,15.0,RMSprop,PRUNED
39,0.6065073386154046,2022-11-21 23:33:22.806663,2022-11-21 23:33:35.092158,0 days 00:00:12.285495,0.08412784196689384,32,4,1,7,,,AdamW,PRUNED
40,0.5573451097545136,2022-11-21 23:33:35.093150,2022-11-21 23:33:47.197929,0 days 00:00:12.104779,0.09548924765146276,15,3,2,17,17.0,,Adam,PRUNED
41,0.5678010131185869,2022-11-21 23:33:47.198710,2022-11-21 23:34:00.505843,0 days 00:00:13.307133,0.0952566889708991,11,7,1,17,,,AdamW,PRUNED
42,0.6367060657228212,2022-11-21 23:34:00.506641,2022-11-21 23:34:44.118767,0 days 00:00:43.612126,0.08877848218677362,12,5,1,13,,,RMSprop,COMPLETE
43,0.647746460579296,2022-11-21 23:34:44.119940,2022-11-21 23:35:11.151642,0 days 00:00:27.031702,0.08917513798066,24,5,1,11,,,RMSprop,COMPLETE
44,0.601766463177036,2022-11-21 23:35:11.153038,2022-11-21 23:35:20.388211,0 days 00:00:09.235173,0.09146504077031771,20,8,2,12,13.0,,RMSprop,PRUNED
45,0.613975841018314,2022-11-21 23:35:20.389174,2022-11-21 23:35:34.511687,0 days 00:00:14.122513,0.0908816965280124,24,8,2,17,14.0,,RMSprop,PRUNED
46,0.5823483569294714,2022-11-21 23:35:34.512871,2022-11-21 23:35:44.502687,0 days 00:00:09.989816,0.09878670638495184,21,4,2,11,10.0,,Adam,PRUNED
47,0.6010520846863229,2022-11-21 23:35:44.503595,2022-11-21 23:36:08.386012,0 days 00:00:23.882417,0.07956810897053188,10,5,1,11,,,Adam,PRUNED
48,0.6755422782179504,2022-11-21 23:36:08.386881,2022-11-21 23:36:44.569575,0 days 00:00:36.182694,0.0867276850663872,30,8,1,18,,,RMSprop,COMPLETE
49,0.658527081439148,2022-11-21 23:36:44.570793,2022-11-21 23:37:12.782382,0 days 00:00:28.211589,0.0802097079236809,25,5,1,18,,,Adam,COMPLETE
